{
  "$schema": "../clip.schema.json",
  "id": "sniff-sniff",
  "videoId": "TzLs1qO7alk",
  "start": 0,
  "end": 95,
  "title": "Sniff Sniff",
  "talent": "Hakos Baelz",
  "lines": [
    {
      "start": 0,
      "end": 1.5,
      "en": "[On-screen: \"Describe the smell of the person on your left side\" (Dec 26, 2021, Absolute Obedience Lottery Game)]",
      "ja": "［画面表示：「左隣の人の匂いを表現してください」（2021年12月26日 絶対服従くじ引きゲーム）］"
    },
    {
      "start": 1.5,
      "end": 3,
      "en": "It's Shion.",
      "ja": "シオンだ"
    },
    {
      "start": 3,
      "end": 5,
      "en": "It's Shion.",
      "ja": "シオンだね"
    },
    {
      "start": 5,
      "end": 6.5,
      "en": "Is it okay if I smell?",
      "ja": "匂い嗅いでもいい？"
    },
    {
      "start": 6.5,
      "end": 8,
      "en": "No way.",
      "ja": "絶対ダメ"
    },
    {
      "start": 8,
      "end": 9,
      "en": "Can I smell?",
      "ja": "嗅いでいい？"
    },
    {
      "start": 9,
      "end": 10,
      "en": "No, no, no! Stop it!!",
      "ja": "だめだめだめ！やめて！！"
    },
    {
      "start": 10,
      "end": 12,
      "en": "Raise your arm, raise it like this...",
      "ja": "腕上げて、こうやって上げて…"
    },
    {
      "start": 12,
      "end": 13,
      "en": "Stop it!!",
      "ja": "やめてー！！"
    },
    {
      "start": 13,
      "end": 15,
      "en": "Show your armpits like this...",
      "ja": "こうやって脇見せて…"
    },
    {
      "start": 15,
      "end": 17,
      "en": "Stop it!!",
      "ja": "やめてってば！！"
    },
    {
      "start": 17,
      "end": 19,
      "en": "Really? I can smell it?",
      "ja": "ほんとに？嗅いでいいの？"
    },
    {
      "start": 19,
      "end": 20.5,
      "en": "Yeah, go ahead.",
      "ja": "うん、どうぞ"
    },
    {
      "start": 20.5,
      "end": 22,
      "en": "Ah~ I see.",
      "ja": "あー、なるほどね"
    },
    {
      "start": 22,
      "end": 24,
      "en": "Hey...",
      "ja": "ちょっと…"
    },
    {
      "start": 24,
      "end": 25,
      "en": "Okay, I got it!",
      "ja": "うん、分かった！"
    },
    {
      "start": 25,
      "end": 27,
      "en": "How was it?",
      "ja": "どうだった？"
    },
    {
      "start": 27,
      "end": 28,
      "en": "So gross...",
      "ja": "うわ、キモい…"
    },
    {
      "start": 28,
      "end": 29,
      "en": "Eh!? Gross!!??",
      "ja": "え！？キモいって！？"
    },
    {
      "start": 29,
      "end": 33,
      "en": "Wait... you're getting overexcited and starting to talk loud.",
      "ja": "待って…テンション上がって声大きくなってるよ"
    },
    {
      "start": 33,
      "end": 34.5,
      "en": "Excuse me.",
      "ja": "失礼しました"
    },
    {
      "start": 34.5,
      "end": 38,
      "en": "Anyway, Shion-chan smells...",
      "ja": "とにかく、シオンちゃんの匂いはね…"
    },
    {
      "start": 38,
      "end": 40,
      "en": "Sweet and fruity.",
      "ja": "甘くてフルーティー"
    },
    {
      "start": 40,
      "end": 43,
      "en": "Oh~ It smells really fruity.",
      "ja": "おー、ほんとにフルーティーな匂いする"
    },
    {
      "start": 43,
      "end": 48,
      "en": "Smells delicious... It's like having a flavor...",
      "ja": "美味しそうな匂い…まるで味があるみたいな…"
    },
    {
      "start": 48,
      "end": 49.5,
      "en": "Delicious.",
      "ja": "美味しそう"
    },
    {
      "start": 49.5,
      "end": 51,
      "en": "No~",
      "ja": "やだー"
    },
    {
      "start": 51,
      "end": 55,
      "en": "Shion-chan's room smells really good.",
      "ja": "シオンちゃんの部屋、ほんといい匂いなんだよね"
    },
    {
      "start": 55,
      "end": 57,
      "en": "Fufufu.",
      "ja": "ふふふ"
    },
    {
      "start": 57,
      "end": 59.5,
      "en": "It smells good when I open it.",
      "ja": "開けるといい匂いするんだ"
    },
    {
      "start": 59.5,
      "end": 62,
      "en": "Yeah, it was really gross when you smelled my bed.",
      "ja": "そうそう、ベッドの匂い嗅がれた時マジでキモかった"
    },
    {
      "start": 62,
      "end": 62.7,
      "en": "Ah?",
      "ja": "あ？"
    },
    {
      "start": 62.7,
      "end": 63,
      "en": "Ahahaha!",
      "ja": "あはははっ！"
    },
    {
      "start": 63,
      "end": 65,
      "en": "When you said \"This is Shion-chan's smell~\"...",
      "ja": "「これがシオンちゃんの匂いか〜」って言った時さ…"
    },
    {
      "start": 65,
      "end": 67,
      "en": "I smelled the towel as well!",
      "ja": "タオルまで嗅いだんだよ！"
    },
    {
      "start": 67,
      "end": 70,
      "en": "Ew!",
      "ja": "うわっ！"
    },
    {
      "start": 70,
      "end": 73,
      "en": "That's me. Let me teach you how to say \"kimoi\" in English, Shion.",
      "ja": "それ私。シオン、「キモい」を英語で何て言うか教えてあげる",
      "notes": [
        {
          "term": "kimoi",
          "meaning": "日本語の「キモい（気持ち悪い）」をそのままローマ字で使っている"
        }
      ]
    },
    {
      "start": 73,
      "end": 74,
      "en": "How do you say it?",
      "ja": "何て言うの？"
    },
    {
      "start": 74,
      "end": 76,
      "en": "It's \"Ewww, disgusting!!\"",
      "ja": "「Ewww, disgusting!!（うわっ、気持ち悪い！）」だよ"
    },
    {
      "start": 76,
      "end": 78,
      "en": "EWWW, DISGUSTING!!",
      "ja": "うわっ、キモい！！"
    },
    {
      "start": 78,
      "end": 80,
      "en": "You are right! Disgusting!!",
      "ja": "その通り！キモい！！"
    },
    {
      "start": 80,
      "end": 81,
      "en": "DISGUSTING!!",
      "ja": "キモい！！"
    },
    {
      "start": 81,
      "end": 82.5,
      "en": "Ah... alright.",
      "ja": "あ…はいはい"
    },
    {
      "start": 82.5,
      "end": 84,
      "en": "Are you guys happy?",
      "ja": "みんな満足した？"
    }
  ]
}
