{
  "$schema": "../clip.schema.json",
  "id": "the-cops-knocked-on-calli-s-door",
  "videoId": "th7ZCGc_DlI",
  "start": 0,
  "end": 132,
  "title": "The Cops Knocked on Calli's Door",
  "talent": "Mori Calliope",
  "lines": [
    {
      "start": 0,
      "end": 4,
      "en": "Uhhhh... I feel like such a dummy...",
      "ja": "あ〜…本当にバカみたい…"
    },
    {
      "start": 4,
      "end": 6,
      "en": "I'm so stupid guys...",
      "ja": "マジ頭悪い…"
    },
    {
      "start": 6,
      "end": 8,
      "en": "Uhhhh...",
      "ja": "あ〜…"
    },
    {
      "start": 8,
      "end": 11,
      "en": "So basically...",
      "ja": "そもそもね…"
    },
    {
      "start": 11,
      "end": 18,
      "en": "I have this card holder right on the back of my phone. There's a card in there that I can literally...",
      "ja": "スマホの背面にカードホルダーがあってね。そこにカードが入ってるんだけど…"
    },
    {
      "start": 18,
      "end": 26,
      "en": "...get in really big trouble for not having on me at all times. (The card needs for the Reaper to be able to walk around in Japan.) And it's gone.",
      "ja": "…いつも持ってないと大変なことになるカードなのに。（死神が日本を歩き回るのに必要なカード）それがなくなっちゃった。"
    },
    {
      "start": 26,
      "end": 29,
      "en": "And you know what's even worse guys?",
      "ja": "でさ、もっと最悪なことがあるんだよ。"
    },
    {
      "start": 29,
      "end": 33,
      "en": "Is that the po-po came up to my door about...",
      "ja": "ポリスが…俺んちのドアに来たのね。"
    },
    {
      "start": 33,
      "end": 42,
      "en": "...a couple hours ago and knocked on the door and I thought they were gonna arrest me so I didn't answer it.",
      "ja": "…数時間前にドアをノックして来てさ。俺を逮捕しに来たんだと思ったから、出なかったんだよ。"
    },
    {
      "start": 42,
      "end": 53,
      "en": "And I bet they were gonna give me the card. I'm so duuumb!!!",
      "ja": "多分、カード渡しに来たんだよ。俺、マジでバカ！"
    },
    {
      "start": 53,
      "end": 57,
      "en": "I'm so stupid!!!",
      "ja": "マジ、ド級のバカ！"
    },
    {
      "start": 57,
      "end": 66,
      "en": "It's scary living in a different country though. When the police come up to your door, man...",
      "ja": "違う国に住んでるのマジ怖いよ。警察がドアに来るなんてさぁ…"
    },
    {
      "start": 66,
      "end": 73,
      "en": "The next day, I went on a grand search for my special card.",
      "ja": "翌日、俺の大切なカードを探しに行った。"
    },
    {
      "start": 73,
      "end": 79,
      "en": "I went to several different places, several different police offices.",
      "ja": "いろんな場所、ポリスのオフィスとかね。"
    },
    {
      "start": 79,
      "end": 84,
      "en": "And while they couldn't find it for me, they did help me.",
      "ja": "見つかんなかったけど、手伝ってくれたんですよ。"
    },
    {
      "start": 84,
      "end": 91,
      "en": "They gave me a thing that says, \"Hey! This reaper is currently looking for their lost item.\"",
      "ja": "「ちょ、この死神が今、失くしたモノを探してます」っていう紙をくれた。"
    },
    {
      "start": 91,
      "end": 100,
      "en": "\"Please don't toss them into jail if you find them and they don't have this card.\"",
      "ja": "「もしこのカードを持ってなかったら刑務所に入れるなよ」っていう感じで。"
    },
    {
      "start": 100,
      "end": 108,
      "en": "So I went on a grand escapade and then I got home.",
      "ja": "それで大冒険して…家に帰ったの。"
    },
    {
      "start": 108,
      "end": 113,
      "en": "And I moved a couple pieces of clothes out of the way",
      "ja": "服をちょっと動かしたら…"
    },
    {
      "start": 113,
      "end": 118,
      "en": "and I found my card.",
      "ja": "カード見つかった。"
    },
    {
      "start": 118,
      "end": 124,
      "en": "I found my card, but that begs the question...",
      "ja": "カード見つかったんだけど…疑問が残るじゃん。"
    },
    {
      "start": 124,
      "end": 132,
      "en": "Why did the po-po come to my house?",
      "ja": "なんでポリスが来たんだよ？"
    }
  ]
}
