{
  "$schema": "../clip.schema.json",
  "id": "office-owl",
  "videoId": "sieqIyCMqS4",
  "start": 0,
  "end": 47,
  "title": "Office Owl (2023)",
  "talent": "Nanashi Mumei",
  "lines": [
    {
      "start": 0.62,
      "end": 1.55,
      "en": "Thank you!",
      "ja": "ありがとー"
    },
    {
      "start": 1.55,
      "end": 2.55,
      "en": "\"Hello Mei\"",
      "ja": "「ハロー、メイ！」"
    },
    {
      "start": 2.55,
      "end": 3.49,
      "en": "Hello!",
      "ja": "ハロー！"
    },
    {
      "start": 3.49,
      "end": 4.46,
      "en": "Thanks for the karaoke,",
      "ja": "「歌枠お疲れ様！」"
    },
    {
      "start": 4.46,
      "end": 6.09,
      "en": "I put you on a speaker as we speak at the—",
      "ja": "「さっき職場で君の歌枠をスピーカーで…」",
      "notes": [
        {
          "term": "as we speak",
          "meaning": "今まさに・ちょうど今。会話中の現在進行を強調する表現"
        }
      ]
    },
    {
      "start": 6.09,
      "end": 8.29,
      "en": "*Eeerghhh!*",
      "ja": "ううぅええ゛え゛！？"
    },
    {
      "start": 8.29,
      "end": 9.46,
      "en": "*Ueeeghhh!*",
      "ja": "えうう゛う゛ぅ…"
    },
    {
      "start": 9.46,
      "end": 10.63,
      "en": "I don't wanna finish it!",
      "ja": "読みたくない！"
    },
    {
      "start": 10.63,
      "end": 12.46,
      "en": "I don't wanna finish what you're saying!",
      "ja": "その先を読みたくなーい！"
    },
    {
      "start": 12.46,
      "end": 14.63,
      "en": "Nooo!",
      "ja": "いやあああ！"
    },
    {
      "start": 15.67,
      "end": 17.3,
      "en": "Mmmmmghhh!",
      "ja": "（咆哮）"
    },
    {
      "start": 19.3,
      "end": 21.24,
      "en": "You did what?!",
      "ja": "何してんの！？"
    },
    {
      "start": 22.34,
      "end": 24.58,
      "en": "Why would you do that?!",
      "ja": "なんでそんなことを！？"
    },
    {
      "start": 27.81,
      "end": 28.85,
      "en": "...as we speak at the office",
      "ja": "「…をスピーカーで流してたら」"
    },
    {
      "start": 28.85,
      "end": 30.68,
      "en": "and all my co-workers are loving your stream and karao—",
      "ja": "「同僚達もたいそう気に入って…」"
    },
    {
      "start": 30.68,
      "end": 32.65,
      "en": "Nmmm!",
      "ja": "ん゛ん゛ん゛ん゛ん゛"
    },
    {
      "start": 36.65,
      "end": 40.16,
      "en": "I'm happy to hear that they were loving the stream and the karaoke.",
      "ja": "職場の皆様が歌枠を楽しんでくれたようで何より"
    },
    {
      "start": 40.16,
      "end": 42.06,
      "en": "I hope you did too.",
      "ja": "同僚もキミもね"
    },
    {
      "start": 42.06,
      "end": 43.56,
      "en": "Thank you, thank you!",
      "ja": "どうもありがとう！"
    },
    {
      "start": 43.99,
      "end": 44.9,
      "en": "Thank you.",
      "ja": "ありがとう…"
    },
    {
      "start": 44.9,
      "end": 46.63,
      "en": "Don. Don don.",
      "ja": "どん…どんどんどん…"
    }
  ]
}
