{
  "$schema": "../clip.schema.json",
  "id": "an-order-you-chattini-cant-refuse",
  "videoId": "2qkTNRa0zhQ",
  "start": 0,
  "end": 107,
  "title": "An Order You Chattini Cant Refuse",
  "talent": "Raora Panthera",
  "lines": [
    {
      "start": 0.22,
      "end": 5.12,
      "en": "Today I went to... Ahh I was...",
      "ja": "今日ね… ああ…"
    },
    {
      "start": 5.12,
      "end": 9.73,
      "en": "I went to buy the plushie I told you about... Right?",
      "ja": "前に言ってたぬいぐるみを買いにいったの"
    },
    {
      "start": 9.73,
      "end": 12.8,
      "en": "And then I went to the shop...",
      "ja": "で、お店に行ったら"
    },
    {
      "start": 13.86,
      "end": 16.97,
      "en": "Looking for that specific plushie",
      "ja": "例のぬいぐるみが"
    },
    {
      "start": 16.97,
      "end": 19.3,
      "en": "And the plushie was not there.",
      "ja": "いくら探してもない"
    },
    {
      "start": 19.3,
      "end": 21.61,
      "en": "The plushie, was GONE.",
      "ja": "もう…なかったの"
    },
    {
      "start": 21.61,
      "end": 25.41,
      "en": "And I felt a void inside my heart.",
      "ja": "心にぽっかりと穴があいたよ",
      "notes": [
        {
          "term": "a void inside my heart",
          "meaning": "心にぽっかりと穴が開いたような感覚"
        }
      ]
    },
    {
      "start": 25.41,
      "end": 29.05,
      "en": "I'm never gonna commit this mistake, ever again.",
      "ja": "こんな過ちは二度と繰り返さない…！",
      "notes": [
        {
          "term": "commit this mistake",
          "meaning": "本来は make this mistake が自然だが、訛りのある話し方の特徴として使われている"
        }
      ]
    },
    {
      "start": 30.65,
      "end": 33.98,
      "en": "It's gone! It's gone!",
      "ja": "もう…手に入らない…！"
    },
    {
      "start": 33.98,
      "end": 42.83,
      "en": "It's gone! Why I didn't buy it! Noahhhhh!",
      "ja": "なぜ買わなかったんだぁ…！うわぁ～ん…！"
    },
    {
      "start": 43.96,
      "end": 49.67,
      "en": "I was so sad! My plushie!",
      "ja": "かなしい～！あたしのぬい～！"
    },
    {
      "start": 50.23,
      "end": 54.1,
      "en": "I was so close to get it! Why I hesitated!",
      "ja": "チャンスはあったのに！なぜためらった！"
    },
    {
      "start": 54.64,
      "end": 58.27,
      "en": "This story is gonna teach you something to you, chattni. BUY IT.",
      "ja": "チャッティーニよ…これを教訓にしなさい 買え",
      "notes": [
        {
          "term": "chattni",
          "meaning": "ファンの愛称「チャッティーニ（Chattini）」の訛った発音"
        }
      ]
    },
    {
      "start": 59.21,
      "end": 63.95,
      "en": "You see it, Ey, I'm real on that.",
      "ja": "見たら、これはガチ",
      "notes": [
        {
          "term": "I'm real on that",
          "meaning": "「これはマジだから」という意味の、なまりのある強調表現"
        }
      ]
    },
    {
      "start": 64.28,
      "end": 66.62,
      "en": "You see it, you buy it!",
      "ja": "見たら！買え！"
    },
    {
      "start": 67.15,
      "end": 70.22,
      "en": "Don't hesitate! Ever again!",
      "ja": "ためらうな！もう絶対に！"
    },
    {
      "start": 71.02,
      "end": 77.89,
      "en": "Don't hesitate! Be determined! Moneys are just money! They dont...",
      "ja": "ためらうな！スパッと決めろ！お金はお金でしかない！"
    },
    {
      "start": 78.33,
      "end": 81.43,
      "en": "They are not gonna do anything in your pocket!",
      "ja": "ポケットに入れたままじゃ意味がない！"
    },
    {
      "start": 82.03,
      "end": 85.74,
      "en": "Buy it! Buy it! Do it!",
      "ja": "買え！買え！やれ！"
    },
    {
      "start": 86.87,
      "end": 91.11,
      "en": "Do it! No hesitation! There is no tomorrow!",
      "ja": "やれ！ためらうな！明日じゃない！"
    },
    {
      "start": 92.18,
      "end": 96.31,
      "en": "There is no tomorrow! There is today!",
      "ja": "明日はない！今日しかない！"
    },
    {
      "start": 96.98,
      "end": 99.05,
      "en": "Today, you buy it!",
      "ja": "今日！買いなさい！"
    },
    {
      "start": 100.52,
      "end": 101.32,
      "en": "End.",
      "ja": "おわり"
    }
  ]
}
